Name	Age	Class	Ticket	Location	Job	Boat	Survived	Sex
PANULA, Mrs Maija Emelia Abrahamintytar	41	3rd Class Passenger	3101295 £39 13s 9d	Southampton			0	F
PARKER, Mr Clifford Richard	17	2nd Class Passenger	14888 £10 10s	Southampton	Clerk		0	M
PARKES, Mr Francis	21	2nd Class Passenger H&W Guarantee Group	239853	Belfast	Plumber		0	M
PARR, Mr William Henry Marsh	29	1st Class Passenger H&W Guarantee Group	112052	Belfast	Electrician		0	M
PARRISH, Mrs Lutie Davis	59	2nd Class Passenger	230433 £26	Southampton		12	1	F
PARSONS, Mr Edward	37	Victualling Crew		Southampton	Chief Storekeeper (1st Class)		0	M
PARSONS, Mr Frank Alfred	26	Engineering Crew		Belfast	Senior 5th. Engineer		0	M
PARSONS, Mr Richard Henry	18	Victualling Crew		Southampton	Saloon Steward (2nd class)		0	M
PARTNER, Mr Austin	40	1st Class Passenger	113043 £28 10s	Southampton	Stockbroker	[166]	0	M
PASCOE, Mr Charles H.	43	Deck Crew		Southampton	Able Seaman	8	1	M
PASIC, Mr Jakob	21	3rd Class Passenger	315097 £8 13s 3d	Southampton	Farmer		0	M
PATCHETT, Mr George	19	3rd Class Passenger	358585 £14 10s	Southampton	Shoemaker		0	M
PAVLOVIC, Mr Stefo	32	3rd Class Passenger	349242 £7 17s 11d	Southampton	General Labourer		0	M
PAYNE, Mr Vivian Ponsonby	22	1st Class Passenger Servant	12749 £93 10s	Southampton	Clerk		0	M
PEACOCK, Master Albert Edward	0	3rd Class Passenger	3101315 £13 15s 6d	Southampton			0	M
PEACOCK, Miss Treasteall	3	3rd Class Passenger	3101315 £13 15s 6d	Southampton			0	F
PEACOCK, Mrs Edith	26	3rd Class Passenger	3101315 £13 15s 6d	Southampton			0	F
PEARCE, Mr Alfred Emest	24	Victualling Crew		Southampton	Steward		0	M
PEARCE, Mr Ernest	32	3rd Class Passenger	343271 £7	Southampton	Farmer		0	M
PEARCE, Mr John	28	Engineering Crew		Southampton	Fireman		1	M
PEARCEY, Mr Albert Victor	25	Victualling Crew		Southampton	Pantry Steward (3rd Class)		1	M
PEARS, Mr Thomas Clinton	29	1st Class Passenger	113776 £66 12s	Southampton	Of Independent Means		0	M
PEARS, Mrs Edith	22	1st Class Passenger	113776 £66 12s	Southampton		8	1	F
PEDERSEN, Mr Olaf	28	3rd Class Passenger	345498 £7 15s 6d	Southampton	General Labourer		0	M
PEDRINI, Sig. Alessandro	21	Restaurant Staff		Southampton	Assistant Waiter	[104]	0	M
PEDUZZI, Mr Giuseppe	24	3rd Class Passenger	2817 £8 1s	Southampton	Waiter		0	M
PEKONIEMI, Mr Edvard	21	3rd Class Passenger	3101294 £7 18s 6d	Southampton	General Labourer		0	M
PELHAM, Mr George	39	Engineering Crew		Southampton	Trimmer	16	1	M
PELTOMäKI, Mr Nikolai Johannes	25	3rd Class Passenger	3101291 £7 18s 6d	Southampton	General Labourer		0	M
PEñASCO Y CASTELLANA, Mr Victor	24	1st Class Passenger	17758 £108 18s	Cherbourg	Of Independent Means		0	M
PEñASCO Y CASTELLANA, Mrs Maria Josefa Perezde Soto y Vallejo	22	1st Class Passenger	17758 £108 18s	Cherbourg	Of Independent Means	8	1	F
PENGELLY, Mr Frederick William	19	2nd Class Passenger	28665 £10 10s	Southampton	Miner		0	M
PENNAL, Mr Thomas Frederick Cohen	33	Victualling Crew		Southampton	Bathroom Steward (1st Class)		0	M
PENNY, Mr William Farr	31	Victualling Crew		Southampton	Assistant Saloon Steward (2nd Class)		0	M
PENROSE, Mr John Poole	49	Victualling Crew		Belfast	Bedroom Steward (1st Class)		0	M
PERACCHIO, Sig. Alberto	20	Restaurant Staff		Southampton	Assistant Waiter		0	M
PERACCHIO, Sig. Sebastiano	17	Restaurant Staff		Southampton	Assistant Waiter		0	M
PERKIN, Mr John Henry	22	3rd Class Passenger	21174 £7 5s	Southampton	Farmer		0	M
PERKINS, Mr Laurence Alexander	22	Victualling Crew		Southampton	Telephone Operator Steward		0	M
PERKIS, Mr Walter John	37	Deck Crew		Belfast	Quartermaster	4	1	M
PERNOT, Mr René	39	2nd Class Passenger Servant	2131 £15 1s	Cherbourg	Chauffeur		0	M
PEROTTI, Sig. Alfonso	20	Restaurant Staff		Southampton	Assistant Waiter		0	M
PERREAULT, Miss Mary Anne	33	1st Class Passenger Servant	12749 £93 10s	Southampton	Personal Maid	3	1	F
PERREN, Mr William Charles	47	Victualling Crew		Southampton	Boots Steward (2nd class)		0	M
PERRITON, Mr Hubert Prouse	31	Victualling Crew		Southampton	Saloon Steward (1st class)		0	M
PERRY, Mr Edgar Lionel	19	Engineering Crew		Southampton	Trimmer		1	M
PERRY, Mr Henry Frederick	23	Engineering Crew		Southampton	Trimmer		0	M
PERSSON, Mr Ernst Ulrik	25	3rd Class Passenger	347083 £7 15s 6d	Southampton	Chauffeur	15	1	M
PERUSCHITZ, Fr Josef	41	2nd Class Passenger	237393 £13	Southampton	Priest / Minister		0	M
PETER / JOSEPH, Master Michael J. ("Michael Joseph")	4	3rd Class Passenger	2668 £22 7s 2d	Cherbourg		D	1	M
PETER / JOSEPH, Miss Anna ("Mary Joseph")	2	3rd Class Passenger	2668 £22 7s 2d	Cherbourg		C	1	F
PETER / JOSEPH, Mrs Catherine	24	3rd Class Passenger	2668 £22 7s 2d	Cherbourg		C	1	F
PETERS, Miss Catherine	26	3rd Class Passenger	330935 £8 2s 9d	Queenstown			0	F
PETERS, Mr William Chapman	26	Deck Crew		Southampton	Able Seaman	9	1	M
PETERSEN, Mr Marius	24	3rd Class Passenger	342441 £8 1s	Southampton	Dairy Worker		0	M
PETRANEC, Miss Matilda	28	3rd Class Passenger	349245 £7 17s 11d	Southampton	Servant		0	F
PETROFF, Mr Nedialco	19	3rd Class Passenger	349212 £7 17s 11d	Southampton	General Labourer		0	M
PETROFF, Mr Pastcho	29	3rd Class Passenger	349215 £7 17s 11d	Southampton	General Labourer		0	M
PETTERSSON, Miss Elin Natalia	18	3rd Class Passenger	347087 £7 15s 6d	Southampton			0	F
PETTERSSON, Mr Johan Emil	25	3rd Class Passenger	347076 £7 15s 6d	Southampton	General Labourer		0	M
PETTY, Mr Edwin Henry	25	Victualling Crew		Southampton	Bedroom Steward (2nd class)	[82]	0	M
PEUCHEN, Major Arthur Godfrey	52	1st Class Passenger	113786 £30 10s	Southampton		6	1	M
PFROPPER, Mr Richard Paul Jozef	30	Victualling Crew		Southampton	Saloon Steward		1	M
PHILLIMORE, Mr Harold Charles William	23	Victualling Crew		Belfast	Saloon Steward (2nd class)	14	1	M
PHILLIPS, Miss Alice Frances Louisa	21	2nd Class Passenger	2 £21	Southampton		12	1	F
PHILLIPS, Miss Kate Florence	19	2nd Class Passenger	250655 £26	Southampton		11	1	F
PHILLIPS, Mr A. George	27	Engineering Crew		Southampton	Greaser		0	M
PHILLIPS, Mr Escott Robert	42	2nd Class Passenger	2 £21	Southampton			0	M
PHILLIPS, Mr John George	25	Victualling Crew		Belfast	Telegraphist		0	M
PHILLIPS, Mr Walter John	35	Restaurant Staff		Southampton	Storekeeper		0	M
PIATTI, Sig. Louis	17	Restaurant Staff		Southampton	Assistant Waiter		0	M
PIAZZA, Sig. Pompeo Gaspro	32	Restaurant Staff		Southampton	Waiter	[266]	0	M
PICARD, Mr Benoît	32	3rd Class Passenger	392078 £8 1s	Southampton	Leather Worker	9	1	M
PINSKY, Mrs Rosa	32	2nd Class Passenger	234604 £13	Southampton		9	1	F
PITFIELD, Mr William James	25	Engineering Crew		Southampton	Greaser		0	M
PITMAN, Mr Herbert John	34	Deck Crew Titanic Officers		Belfast	3rd. Officer	5	1	M
PLATT, Mr Wilfred George	18	Victualling Crew		Southampton	Scullion		0	M
PLOTCHARSKY, Mr Vasil	27	3rd Class Passenger	349227 £7 17s 11d	Southampton	General Labourer		0	M
PODESTA, Mr Alfred John Alexander	24	Engineering Crew		Southampton	Fireman		1	M
POGGI, Sig. Emilio	28	Restaurant Staff		Southampton	Waiter	[301]	0	M
POINGDESTRE, Mr John Thomas	33	Deck Crew		Southampton	Able Seaman	12	1	M
POKRNIC, Mr Mate	17	3rd Class Passenger	315095 £8 13s 3d	Southampton			0	M
POKRNIC, Mr Tome	24	3rd Class Passenger	315092 £8 13s 3d	Southampton			0	M
POND, Mr George	32	Engineering Crew		Southampton	Fireman		0	M
PONESELL, Mr Martin	24	2nd Class Passenger	250647 £13	Southampton			0	M
POOK, Mr Percy Robert	34	Victualling Crew		Southampton	Assistant pantry steward		0	M
PORT, Mr Frank	22	Victualling Crew		Southampton	Steward		1	M
PORTALUPPI, Mr Emilio Ilario Giuseppe	30	2nd Class Passenger	34644 £12 14s 9d	Cherbourg		14	1	M
PORTER, Mr Walter Chamberlain	46	1st Class Passenger	110465 £52	Southampton		[207]	0	M
PORTEUS, Mr Thomas Henry	32	Victualling Crew		Southampton	Butcher		0	M
POTTER, Mrs Lily Alexenia	56	1st Class Passenger	11767 £83 3s 2d	Cherbourg		7	1	F
PRANGNELL, Mr George Alexander	30	Engineering Crew		Southampton	Greaser	B	1	M
PRENTICE, Mr Frank Winnold	23	Victualling Crew		Southampton	Storekeeper		1	M
PRESTON, Mr Thomas Charles Alfred	20	Engineering Crew		Southampton	Trimmer		0	M
PRICE, Mr Ernest Cyril	17	Restaurant Staff		Southampton	Barman	[186]	0	M
PRICHARD, Mrs Alice Maud	34	Victualling Crew		Southampton	Stewardess	11	1	F
PRIDEAUX, Mr John Arthur (Jack)	23	Victualling Crew		Southampton	3rd Class Steward		0	M
PRIEST, Mr Arthur John	24	Engineering Crew		Southampton	Fireman		1	M
PRIOR, Mr Harold John Arnold	21	Victualling Crew		Southampton	Steward (3rd Class)		1	M
PROCTOR, Mr Charles	45	Victualling Crew		Belfast	Chef		0	M
PROUDFOOT, Mr Richard Royston	23	Engineering Crew		Southampton	Trimmer		0	M
PRYCE, Mr Charles William	22	Victualling Crew		Southampton	Saloon Steward (1st class)		0	M
PUGH, Mr Alfred	20	Victualling Crew		Southampton	3rd Class Steward	14	1	M
PUGH, Mr Arthur Percy	31	Engineering Crew		Southampton	Leading Fireman		0	M
PULBAUM, Mr Franz	27	2nd Class Passenger	2168 £15 8d	Cherbourg			0	M
PULNER, Mr Uscher	16	3rd Class Passenger	3411 £8 14s 3d	Cherbourg			0	M
PUSEY, Mr William Robert Holland	22	Engineering Crew		Southampton	Fireman	1	1	M
PUZEY, Mr John Edward	44	Victualling Crew		Belfast	Saloon Steward (1st class)		0	M
QUICK, Miss Phyllis May	2	2nd Class Passenger	26360 £26	Southampton		11	1	F
QUICK, Miss Winifred Vera	8	2nd Class Passenger	26360 £26	Southampton		11	1	F
QUICK, Mrs Jane	33	2nd Class Passenger	26360 £26	Southampton		11	1	F
RADEFF, Mr Alexander	27	3rd Class Passenger	349223 £7 17s 11d	Southampton	General Labourer		0	M
RANDALL, Mr Frank Henry	29	Victualling Crew		Southampton	Saloon Steward (2nd class)		0	M
RANGER, Mr Thomas	29	Engineering Crew		Southampton	Greaser	4	1	M
RANSOM, Mr James Augustus	49	Victualling Crew		Belfast	Saloon Steward (1st class)		0	M
RASMUSSEN, Mrs Lena Jakobsen	63	3rd Class Passenger	65305 £8 2s 3d	Southampton			0	F
RATTENBURY, Mr William Henry	37	Victualling Crew		Belfast	Boots steward (1st class)		0	M
RATTI, Sig. Enrico	21	Restaurant Staff		Southampton	Waiter		0	M
RAY, Mr Frederick Dent	32	Victualling Crew		Belfast	Saloon Steward	13	1	M
RAZI, Mr Raihed	30	3rd Class Passenger	2629 £7 4s 7d	Cherbourg			0	M
READ, Mr Joseph	21	Engineering Crew		Southampton	Trimmer		0	M
REED, Mr James George	19	3rd Class Passenger	362316 £7 5s	Southampton	Butcher		0	M
REED, Mr Thomas Charles Prowse	54	Victualling Crew		Southampton	Bed Room Steward		0	M
REEVES, Mr David	36	2nd Class Passenger	17248 £10 10s	Southampton	Carpenter / Joiner		0	M
REEVES, Mr Frederick Simms	33	Engineering Crew		Southampton	Fireman	[180]	0	M
REID, Mr Robert Thomas	30	Engineering Crew		Southampton	Trimmer		0	M
REKIC, Mr Tido	38	3rd Class Passenger	349249 £7 17s 11d	Southampton	General Labourer		0	M
RENOUF, Mr Peter Henry	33	2nd Class Passenger	31027 £21	Southampton	Carpenter / Joiner		0	M
RENOUF, Mrs Lillian	30	2nd Class Passenger	31027 £21	Southampton			1	F
REUCHLIN, Mr Jonkheer Johan George	38	1st Class Passenger	19972	Cherbourg			0	M
REVELL, Mr William James Francis	31	Victualling Crew		Belfast	Saloon Steward (1st class)		0	M
REYNALDS, Sra. Encarnación	28	2nd Class Passenger	230434 £13	Southampton		9	1	F
REYNOLDS, Mr Harold	21	3rd Class Passenger	342684 £8 1s	Southampton	Baker	[327]	0	M
RHEIMS, Mr George Alexander Lucien	33	1st Class Passenger	17607 £39 12s	Cherbourg	Businessman	A	1	M
RICALDONE, Sig. Rinaldo Renato	22	Restaurant Staff		Southampton	Assistant Waiter		0	M
RICE, Master Albert	10	3rd Class Passenger	382652 £29 2s 6d	Queenstown			0	M
RICE, Master Arthur	4	3rd Class Passenger	382652 £29 2s 6d	Queenstown			0	M
RICE, Master Eric	7	3rd Class Passenger	382652 £29 2s 6d	Queenstown			0	M
RICE, Master Eugene Francis	2	3rd Class Passenger	382652 £29 2s 6d	Queenstown			0	M
RICE, Master George Hugh	8	3rd Class Passenger	382652 £29 2s 6d	Queenstown			0	M
RICE, Mr Charles	32	Engineering Crew		Southampton	Fireman	10	1	M
RICE, Mr John Reginald	25	Victualling Crew		Southampton	1st Class Clerk	[64]	0	M
RICE, Mr Percy	19	Victualling Crew		Southampton	3rd Class Steward		0	M
RICE, Mrs Margaret	39	3rd Class Passenger	382652 £29 2s 6d	Queenstown	Housekeeper	[12]	0	F
RICHARD, Mr Emile Phillippe	23	2nd Class Passenger	2133 £15 11d	Cherbourg			0	M
RICHARDS, Master Sibley George	0	2nd Class Passenger	29106 £18 15s	Southampton		4	1	M
RICHARDS, Master William Rowe	3	2nd Class Passenger	29106 £18 15s	Southampton		4	1	M
RICHARDS, Mr Joseph James	28	Engineering Crew		Southampton	Fireman		0	M
RICHARDS, Mrs Emily	24	2nd Class Passenger	29106 £18 15s	Southampton		4	1	F
RICKMAN, Mr George Albert	36	Engineering Crew		Southampton	Fireman		0	M
RICKS, Mr Cyril Gordon	23	Victualling Crew		Southampton	Storekeeper	[100]	0	M
RIDOUT, Mr Walter George	29	Victualling Crew		Southampton	Second Class Saloon Steward		0	M
RIDSDALE, Miss Lucy	58	2nd Class Passenger	14258 £10 10s	Southampton		13	1	F
RIGHINI, Mr Sante	22	1st Class Passenger Servant	17760 £135 12s 8d	Cherbourg	Servant	[232]	0	M
RIGOZZI, Sig. Abele	22	Restaurant Staff		Southampton	Assistant Waiter	[115]	0	M
RIIHIVUORI, Miss Susanna Juhantytär	22	3rd Class Passenger	3101295 £39 13s 9d	Southampton			0	F
RIMMER, Mr Gilbert	28	Victualling Crew		Southampton	Saloon Steward		0	M
RINTAMäKI, Mr Matti	35	3rd Class Passenger	3101273 £7 2s 6d	Southampton	General Labourer		0	M
RIORDAN, Miss Hannah	18	3rd Class Passenger	334915 £7 14s 5d	Queenstown		13	1	F
RISIEN, Mr Samuel Beard	69	3rd Class Passenger	364498 £14 10s	Southampton	Hotelier		0	M
RISIEN, Mrs Emma Jane	58	3rd Class Passenger	364498 £14 10s	Southampton			0	F
ROBERT, Mrs Elisabeth Walton	43	1st Class Passenger	24160 £211 6s 9d	Southampton	Of Independent Means	2	1	F
ROBERTON, Mr George Edward	19	Victualling Crew		Southampton	Assistant Saloon Steward (2nd Class)	[127]	0	M
ROBERTS, Mr Frank John	36	Victualling Crew		Belfast	Third Butcher	[231]	0	M
ROBERTS, Mr Hugh H.	40	Victualling Crew		Belfast	Bed Room Steward	[93]	0	M
ROBERTS, Mr Robert George	35	Engineering Crew		Southampton	Fireman		0	M
ROBERTS, Mrs Mary Kezia	41	Victualling Crew		Southampton	Stewardess	16	1	F
ROBINS, Mr Alexander A.	50	3rd Class Passenger	3337 £14 10s	Southampton	Mason	[119]	0	M
ROBINS, Mr Victor	42	1st Class Passenger Servant	17757 £247 10s 6d	Cherbourg	Servant		0	M
ROBINS, Mrs Charity	47	3rd Class Passenger	3337 £14 10s	Southampton		[7]	0	F
ROBINSON, Mr James William	30	Victualling Crew		Southampton	Saloon Steward (1st class)	[151]	0	M
ROBINSON, Mrs Annie	40	Victualling Crew		Southampton	Stewardess	11	1	F
ROEBLING, Mr Washington Augustus II	31	1st Class Passenger	17590 £50 9s 11d	Southampton	Of Independent Means		0	M
ROGERS, Mr Edward James William	31	Victualling Crew		Southampton	Assistant Storekeeper	[282]	0	M
ROGERS, Mr Michael	27	Victualling Crew		Southampton	Saloon Steward		0	M
ROGERS, Mr Reginald Harry	18	2nd Class Passenger	28004 £10 10s	Southampton			0	M
ROGERS, Mr William John	29	3rd Class Passenger	23567 £8 1s	Southampton	Miner		0	M
ROMAINE, Mr Charles Hallace	45	1st Class Passenger	111428 £26 11s	Southampton		9	1	M
ROMMETVEDT, Mr Knud Paust	49	3rd Class Passenger	312993 £7 15s 6d	Southampton	Tailor		0	M
ROOD, Mr Hugh Roscoe	39	1st Class Passenger	113767 £50	Southampton	Businessman		0	M
ROSBLOM, Miss Salli Helena	2	3rd Class Passenger	370129 £20 4s 3d	Southampton			0	F
ROSBLOM, Mr Viktor Richard	18	3rd Class Passenger	370129 £20 4s 3d	Southampton	General Labourer		0	M
ROSBLOM, Mrs Helena Wilhelmina	41	3rd Class Passenger	370129 £20 4s 3d	Southampton			0	F
ROSENBAUM, Miss Edith Louise	33	1st Class Passenger	17613 £27 14s 5d	Cherbourg	Journalist	11	1	F
ROSENSHINE, Mr George	46	1st Class Passenger	17585 £79 4d	Cherbourg	Merchant	[16]	0	M
ROSS, Mr Horace Leopold	38	Victualling Crew		Southampton	Scullion	13	1	M
ROSS, Mr John Hugo	36	1st Class Passenger	13049 £40 2s 6d	Southampton			0	M
ROTH, Miss Sarah	31	3rd Class Passenger	342712 £8 1s	Southampton	Tailor	C	1	F
ROTHES, Lucy Noël Martha, Countess of	33	1st Class Passenger	110152 £86 10s	Southampton	Of Independent Means	8	1	F
ROTHSCHILD, Mr Martin	46	1st Class Passenger	17603 £59 8s	Cherbourg			0	M
ROTHSCHILD, Mrs Elizabeth Jane Anne	54	1st Class Passenger	17603 £59 8s	Cherbourg		6	1	F
ROTTA, Sig. Angelo Mario	23	Restaurant Staff		Southampton	Waiter		0	M
ROUS, Mr Arthur John	26	Engineering Crew		Belfast	Plumber		0	M
ROUSE, Mr Richard Henry	53	3rd Class Passenger	3594 £8 1s	Southampton	Farm Labourer		0	M
ROUSSEAU, Mr Pierre	49	Restaurant Staff		Southampton	Chef		0	M
ROWE, Mr Alfred G.	59	1st Class Passenger	113790 £26 11s	Southampton	Landowner	[109]	0	M
ROWE, Mr Edgar Maurice	31	Victualling Crew		Belfast	Saloon Steward (1st class)		0	M
ROWE, Mr George Thomas	32	Deck Crew		Belfast	Quartermaster	C	1	M
RUDD, Mr Henry	23	Engineering Crew		Southampton	Engineers' storekeeper	[86]	0	M
RUGG, Miss Emily	21	2nd Class Passenger	31026 £10 10s	Southampton		12	1	F
RULE, Mr Samuel James	58	Victualling Crew		Belfast	Bathroom Steward (1st Class)		1	M
RUSH, Mr Alfred George John		3rd Class Passenger	20589 £8 1s	Southampton	Porter		0	M
RUSSELL, Mr Boysie Richard	17	Victualling Crew		Southampton	Saloon Steward (2nd class)		0	M
RUTTER, Mr Sidney Frank	26	Engineering Crew		Southampton	Fireman		0	M
RYAN, Mr Edward	24	3rd Class Passenger	383162 £7 15s	Queenstown	General Labourer	14	1	M
RYAN, Mr Patrick		3rd Class Passenger	371110 £24 3s	Queenstown	General Labourer		0	M
RYAN, Mr Thomas	27	Victualling Crew		Southampton	Steward		0	M
RYERSON, Master John Borie	13	1st Class Passenger	17608 £262 7s 6d	Cherbourg		4	1	M
RYERSON, Miss Emily Borie	18	1st Class Passenger	17608 £262 7s 6d	Cherbourg		4	1	F
RYERSON, Miss Susan Parker "Suzette"	21	1st Class Passenger	17608 £262 7s 6d	Cherbourg		4	1	F
RYERSON, Mr Arthur Larned	61	1st Class Passenger	17608 £262 7s 6d	Cherbourg			0	M
RYERSON, Mr William Edwy	33	Victualling Crew		Southampton	Saloon Steward (2nd class)		1	M
RYERSON, Mrs Emily Maria	48	1st Class Passenger	17608 £262 7s 6d	Cherbourg		4	1	F
SAAD, Mr Amin	30	3rd Class Passenger	2671 £7 4s 7d	Cherbourg	Farm Labourer		0	M
SAAD, Mr Khalil	27	3rd Class Passenger	2672 £7 4s 6d	Cherbourg	Farm Labourer		0	M
SAALFELD, Mr Adolphe	47	1st Class Passenger	19988 £30 10s	Southampton	Businessman	3	1	M
SACCAGGI, Sig. Giovanni Giuseppe Emilio	24	Restaurant Staff		Southampton	Assistant Waiter		0	M
SADLIER, Mr Matthew	18	3rd Class Passenger	367655 £7 14s 7d	Queenstown	Farm Labourer		0	M
SADOWITZ, Mr Henry	17	3rd Class Passenger	1855 £7 11s 10d	Southampton	Fur Cutter		0	M
SæTHER, Mr Simon Sivertsen	43	3rd Class Passenger	3101262 £7 5s	Southampton	Miner	[32]	0	M
SAGE, Master Anthony William	12	3rd Class Passenger	2343 £69 11s	Southampton		[67]	0	M
SAGE, Master Thomas Henry	4	3rd Class Passenger	2343 £69 11s	Southampton			0	M
SAGE, Miss Constance Gladys	7	3rd Class Passenger	2343 £69 11s	Southampton			0	F
SAGE, Miss Dorothy	14	3rd Class Passenger	2343 £69 11s	Southampton	Scholar		0	F
SAGE, Miss Elizabeth Ada	10	3rd Class Passenger	2343 £69 11s	Southampton			0	F
SAGE, Miss Stella Anne	20	3rd Class Passenger	2343 £69 11s	Southampton	Dressmaker / Couturi�re		0	F
SAGE, Mr Douglas Bullen	18	3rd Class Passenger	2343 £69 11s	Southampton	Baker		0	M
SAGE, Mr Frederick	16	3rd Class Passenger	2343 £69 11s	Southampton	Cook		0	M
SAGE, Mr George John	19	3rd Class Passenger	2343 £69 11s	Southampton	Barman		0	M
SAGE, Mr John George	44	3rd Class Passenger	2343 £69 11s	Southampton	Tradesman		0	M
SAGE, Mrs Annie Elizabeth	44	3rd Class Passenger	2343 £69 11s	Southampton			0	F
SäGESSER, Mlle Emma	24	1st Class Passenger Servant	17477 £69 6s	Cherbourg	Personal Maid	9	1	F
SALANDER, Mr Karl Johan	24	3rd Class Passenger	7266 £9 6s 6d	Southampton	General Labourer		0	M
SALKJELSVIK, Miss Anna Kristine	21	3rd Class Passenger	343120 £7 13s	Southampton		C	1	F
SALOMON, Mr Abraham Lincoln	43	1st Class Passenger	111163 £26	Cherbourg	Businessman	1	1	M
SALONEN, Mr Johan Werner	29	3rd Class Passenger	3101296 £7 18s 6d	Southampton	General Labourer		0	M
SALUSSOLIA, Sig. Govanni	25	Restaurant Staff		Southampton	Glass Man		0	M
SAMAAN, Mr Elias	17	3rd Class Passenger	2662 £21 13s 7d	Cherbourg	General Labourer		0	M
SAMAAN, Mr Hanna Elias	40	3rd Class Passenger	2662 £21 13s 7d	Cherbourg	General Labourer		0	M
SAMAAN, Mr Youssef	16	3rd Class Passenger	2662 £21 13s 7d	Cherbourg	General Labourer		0	M
SAMUEL, Mr Owen Wilmore	46	Victualling Crew		Southampton	Saloon Steward (2nd class)	[217]	0	M
SANDSTRöM, Miss Beatrice Irene	1	3rd Class Passenger	9549 £16 14s	Southampton		13	1	F
SANDSTRöM, Miss Marguerite Rut	4	3rd Class Passenger	9549 £16 14s	Southampton		13	1	F
SANDSTRöM, Mrs Agnes Charlotta	24	3rd Class Passenger	9549 £16 14s	Southampton		13	1	F
SANGSTER, Mr Charles Edward	32	Engineering Crew		Southampton	Fireman		0	M
SAP, Mr Julius ("Jules _")	21	3rd Class Passenger	345768 £9 10s	Southampton		11	1	M
SARTORI, Sig. Lazar	24	Restaurant Staff		Southampton	Assistant Glass Man		0	M
SAUNDERCOCK, Mr William Henry	19	3rd Class Passenger	2151 £8 1s	Southampton	Miner		0	M
SAUNDERS, Mr D. E.	26	Victualling Crew		Southampton	Saloon Steward		0	M
SAUNDERS, Mr F.	22	Engineering Crew		Southampton	Fireman		0	M
SAUNDERS, Mr W.	23	Engineering Crew		Southampton	Fireman		0	M
SAUNDERS, Mr Walter Ernest	23	Engineering Crew		Southampton	Trimmer	[184]	0	M
SAVAGE, Mr Charles Joseph	23	Victualling Crew		Southampton	Steward	11	1	M
SAWYER, Mr Frederick Charles	33	3rd Class Passenger	342826 £8 1s	Southampton	Gardener	[284]	0	M
SAWYER, Mr Robert James	31	Deck Crew		Southampton	Window Cleaner		0	M
SCANLAN, Mr James	22	3rd Class Passenger	36209 £7 14s 6d	Queenstown			0	M
SCARROTT, Mr Joseph George	33	Deck Crew		Southampton	Able Seaman	14	1	M
SCAVINO, Sig. Candido	42	Restaurant Staff		Southampton	Carver		0	M
SCHABERT, Mrs Emma	35	1st Class Passenger	13236 £57 15s	Cherbourg		11	1	F
SCHEERLINCK, Mr Jean	29	3rd Class Passenger	345779 £9 10s	Southampton		11	1	M
SCHMIDT, Mr Augustus	21	2nd Class Passenger	248659 £13	Southampton			0	M
SCOTT, Mr Archibald	41	Engineering Crew		Southampton	Fireman		0	M
SCOTT, Mr Frederick William	28	Engineering Crew		Southampton	Greaser	4	1	M
SCOTT, Mr John	19	Victualling Crew		Southampton	Assistant boots steward (1st Class)		0	M
SCOVELL, Mr Robert	54	Victualling Crew		Southampton	Saloon Steward (2nd class)		0	M
SDYCOFF, Mr Todor	42	3rd Class Passenger	349222 £7 17s 11d	Southampton			0	M
SEDGWICK, Mr Charles Frederick Waddington	28	2nd Class Passenger	244361 £13	Southampton			0	M
SEDUNARY, Mr Samuel Francis	25	Victualling Crew		Southampton	Second third class steward		0	M
SELF, Mr Albert Charles Edward	24	Engineering Crew		Southampton	Fireman		1	M
SELF, Mr Alfred Henry	39	Engineering Crew		Southampton	Greaser		0	M
SEMAN, Master Betros	10	3rd Class Passenger	2622 £4 3d	Cherbourg			0	M
SENIOR, Mr Harry	31	Engineering Crew		Southampton	Fireman		1	M
SERREPLAN, Miss Auguste	30	1st Class Passenger Servant	113798 £31	Southampton	Personal Maid	4	1	F
SESIA, Sig. Giacomo	24	Restaurant Staff		Southampton	Waiter		0	M
SEWARD, Mr Frederic Kimber	34	1st Class Passenger	113794 £26 11s	Southampton	Lawyer	7	1	M
SEWARD, Mr Wilfred Deable	25	Victualling Crew		Southampton	Chief Pantry Steward (2nd Class)	3	1	M
SHANNON, Mr Andrew John	36	3rd Class Passenger	370160	Southampton	Seaman		0	M
SHARP, Mr Percival	27	2nd Class Passenger	244358 £26	Southampton			0	M
SHAUGHNESSY, Mr Patrick	24	3rd Class Passenger	370374 £7 15s	Queenstown	Farm Labourer		0	M
SHAW, Mr Henry	39	Victualling Crew		Southampton	Kitchen Porter		0	M
SHEA, Mr John Joseph	39	Victualling Crew		Belfast	Saloon Steward (1st class)	[11]	0	M
SHEA, Mr Thomas	32	Engineering Crew		Southampton	Fireman		0	M
SHEATH, Mr Frederick	20	Engineering Crew		Southampton	Trimmer	1	1	M
SHEDID, Mr Daher	19	3rd Class Passenger	2698 £7 4s 6d	Cherbourg		[9]	0	M
SHELLARD, Mr Frederick William Blainey	55	3rd Class Passenger	6212 £15 2s	Southampton	Painter & Decorator		0	M
SHELLEY, Mrs Imanita Parrish	25	2nd Class Passenger	230433 £26	Southampton		12	1	F
SHEPHERD, Mr Jonathan	32	Engineering Crew		Southampton	Junior Assistant 2nd. Engineer		0	M
SHIERS, Mr Alfred Charles	25	Engineering Crew		Southampton	Fireman		1	M
SHIHāB, Mr Al-Amīr Fāris	29	3rd Class Passenger	2631 £7 4s 6d	Cherbourg	General Labourer		0	M
SHILLABEER, Mr Charles Frederick	19	Engineering Crew		Southampton	Trimmer	[195]	0	M
SHINE, Miss Ellen	20	3rd Class Passenger	330968 £7 16s 7d	Queenstown			1	F
SHORNEY, Mr Charles Joseph	22	3rd Class Passenger	374910 £8 1s	Southampton	Valet		0	M
SHUTES, Miss Elizabeth Weed	40	1st Class Passenger Servant	17582 £153 9s 3d	Southampton	Governess	3	1	F
SIEBERT, Mr Sidney Conrad	29	Victualling Crew		Belfast	Bed Room Steward	4	0	M
SILVéN, Miss Lyyli Karoliina	17	2nd Class Passenger	250652 £13	Southampton		16	1	F
SILVERTHORNE, Mr Spencer Victor	35	1st Class Passenger	17475 £26 5s 9d	Southampton		5	1	M
SILVEY, Mr William Baird	51	1st Class Passenger	13507 £55 18s	Cherbourg	Businessman		0	M
SILVEY, Mrs Alice Gray	39	1st Class Passenger	13507 £55 18s	Cherbourg		11	1	F
SIMMONS, Mr Andrew George James	31	Victualling Crew		Southampton	Scullion		1	M
SIMMONS, Mr Frederick Charles	24	Victualling Crew		Southampton	Saloon Steward		0	M
SIMMONS, Mr John	40	3rd Class Passenger	392082 £8 1s	Southampton	General Labourer		0	M
SIMMONS, Mr William Simon C.	35	Victualling Crew		Southampton	Passage Cook		0	M
SIMONIUS-BLUMER, Mr Colonel (Oberst) Alfons	56	1st Class Passenger	13213 £35 10s	Southampton	Banker	3	1	M
SIMPSON, Dr John Edward	37	Deck Crew		Southampton	Assistant Surgeon		0	M
SINCOCK, Miss Maude	20	2nd Class Passenger	33112 £36 15s	Southampton		11	1	F
SINKKONEN, Miss Anna	29	2nd Class Passenger	250648 £13	Southampton		10	1	F
SIRAYANIAN, Mr Orsen	22	3rd Class Passenger	2669 £7 4s 7d	Cherbourg	Farmer		0	M
